No.,業界,細分化業界,職種,従業員数,所在地,事例タイトル,サブタイトル,記事概要,課題背景,具体的問題点,現在数値,業務フロー問題,担当者悩み,導入ツール,実装手順,研修内容,カスタマイズ内容,導入期間,定量的効果,作業時間短縮,コスト削減効果,品質向上指標,副次的効果,成功要因分析,現場変化,今後計画,参考ポイント,使用ツール詳細,連携システム,データフロー,セキュリティ対策,記事ステータス,記事URL,note投稿,LinkedIn投稿,作成日,記事作成日,更新日,タグ
151,教育・保育業,認定こども園,施設長,40,中部,中部地域の認定こども園がGAS+ChatGPT導入で業務効率90%改善を実現した詳細事例,保護者との信頼関係強化と職員働きやすさを同時実現するシステム導入法,認定こども園が90%の業務効率化を実現。Googleフォーム+GAS+ChatGPTによる教育・保育管理システムで、従来の手作業業務を刷新し、子どもの安全と保護者満足度を大幅改善した成功事例。中部地域の教育・保育業界特性を考慮した実用的なデジタル化を低コストで実現。,認定こども園業界では子どもの安全確保と発達支援の質向上が最重要課題となる中、従来の手作業による記録・管理では情報共有の遅れや見落としリスクが生じている。デジタル化による安全性と効率性の向上が必要。,保護者からの相談対応記録が属人化、子どもの発達記録が紙ベースで経年変化把握困難、職員間申し送りが口頭で情報共有ミス、行事準備・連絡調整に週10時間、安全点検記録が紙で管理煩雑,体調管理記録：1日60分、アレルギー確認：食事毎15分、保護者連絡帳：1日30分、職員引き継ぎ：20分、園児満足度：95%,①登園・登校確認→出席記録→保護者連絡→一日の活動の流れで、出席状況の共有遅れにより保護者不安。②活動記録→写真撮影→連絡帳作成→保護者共有の流れで、記録作成に時間がかかり子どもと向き合う時間減少。,「保護者の要望を覚えきれない」「子どもの発達記録の整理が大変」「職員間の申し送りが不十分」「行事準備の段取りが煩雑」,Googleフォーム学習記録+GAS進捗管理+ChatGPT個別指導計画,①現行業務・保護者ニーズ詳細分析（3日）②子どもの安全・プライバシー配慮システム設計（4日）③Googleフォーム・GAS開発（5日）④ChatGPT教育支援機能実装（2日）⑤職員研修・習熟（1週間）⑥段階的運用開始（2週間）,タブレット・スマートフォン基本操作、教育・保育業務特化Googleフォーム活用、GAS自動化による業務効率化、子どもの安全を最優先としたシステム運用、保護者満足度向上のための情報活用、継続的改善プロセス構築,認定こども園業界の専門用語・記録様式に対応したシステム、教育・保育制度の要件を満たすデータ管理、多職種チーム連携のための情報共有設定、子どものプライバシー保護を最優先とした安全設計,10週間,体調記録時間：45分→15分（70%削減）、保護者連絡時間：40分→15分（70%削減）、安全管理精度：85%→98%、子どもの安全：事故0件達成,体調・安全管理：週8時間→3時間、保護者連絡：週6時間→2時間、記録整理：週5時間→1時間,運営効率化：月10万円、保護者満足度向上による入園・入塾増：月50万円、離職率低下：年80万円,学習効果向上：85%の生徒・保護者から高評価、個別対応満足度：90%、出席率向上：12ポイント、紹介率：30%向上,職員のデジタルスキル向上、チームワーク強化、保護者との信頼関係向上、地域教育・保育業界での先進事例として注目,現場業務に即したカスタマイズ、低コストでの実現可能性追求、多職種連携を重視した設計、成果の見える化による動機向上,IT活用による業務革新への意識変革、保護者からの評価向上による自信増、継続的学習・改善への取り組み強化、離職率低下とチーム安定化,予防的教育・保育システムの導入、地域子育て支援システムとの連携強化、保護者向けサービス拡充、教育・保育業界DX推進のリーダーシップ,地方教育・保育施設でも月10万円以下で品質向上実現、子どものプライバシー保護を最優先とした設計、職員の働きやすさと保護者満足度の両立、法令遵守の重要性,Googleフォーム+GAS+ChatGPTの教育・保育特化連携、子ども情報自動分類・個別支援計画支援、出席・体調記録自動化、保護者連絡自動生成,既存保育・教育システムとの連携、保護者向けアプリとの連動、給食管理システムとの統合、地域子育て支援システムとの連携,出席・体調記録→自動異常検知→担当者通知→対応記録→効果測定→個別計画更新,個人情報保護法・子ども関連法令準拠、職員向けプライバシー保護研修、システムログの監視・管理、インシデント対応体制,事例のみ,,,,2025-07-08,2025-07-08,,"教育・保育業,認定こども園,AI活用,業務効率化,Googleフォーム,GAS,ChatGPT,地方中小企業,中部,子ども中心,保護者満足度"
152,教育・保育業,絵画教室,教室長,20,関西,従業員20名の絵画教室がGoogleフォーム工夫で個別支援50%改善,子どもの安全と発達支援を最優先とした効率的な情報管理システム,絵画教室が50%の業務効率化を実現。Googleフォーム+GAS+ChatGPTによる教育・保育管理システムで、従来の手作業業務を刷新し、子どもの安全と保護者満足度を大幅改善した成功事例。関西地域の教育・保育業界特性を考慮した実用的なデジタル化を低コストで実現。,コロナ禍により絵画教室では感染対策と通常の教育・保育活動の両立が求められ、保護者とのコミュニケーション方法も大きく変化している。関西地域の特性を活かした新しい運営スタイルの確立が必要。,保護者からの相談対応記録が属人化、子どもの発達記録が紙ベースで経年変化把握困難、職員間申し送りが口頭で情報共有ミス、行事準備・連絡調整に週10時間、安全点検記録が紙で管理煩雑,学習進捗確認：1人平均25分、保護者面談準備：1回60分、教材管理：週3時間、生徒満足度：80%、保護者満足度：90%,①登園・登校確認→出席記録→保護者連絡→一日の活動の流れで、出席状況の共有遅れにより保護者不安。②活動記録→写真撮影→連絡帳作成→保護者共有の流れで、記録作成に時間がかかり子どもと向き合う時間減少。,「子どもの様子を保護者に正確に伝えたい」「記録作成で子どもと向き合う時間が減る」「保護者からの相談内容を忘れがち」「職員間で情報共有が漏れがち」,Googleフォーム出席管理+GAS自動通知+ChatGPT保護者連絡支援,①現場ニーズ・課題ヒアリング（3日）②プロトタイプ開発・検証（1週間）③本格システム開発（8日）④操作マニュアル・研修準備（3日）⑤全職員研修・保護者説明（1週間）⑥運用開始・継続サポート（継続）,クラウドサービス安全活用法、個別支援計画のデジタル化手法、多職種連携のための情報共有システム、子ども・保護者のニーズに応じたサービス向上、教育・保育制度に準拠したシステム運用、リスク管理とトラブル対応,絵画教室特有の教育・保育記録項目に対応したフォーム設計、関西地域の教育・保育制度に準拠した管理機能、子どもの年齢・発達段階に応じた個別対応設定、保護者・関係機関との連携を重視したコミュニケーション機能,1ヶ月,体調記録時間：60分→15分（70%削減）、保護者連絡時間：40分→10分（60%削減）、安全管理精度：90%→95%、子どもの安全：事故0件達成,体調・安全管理：週8時間→3時間、保護者連絡：週6時間→2時間、記録整理：週5時間→1時間,運営効率化：月20万円、保護者満足度向上による入園・入塾増：月20万円、離職率低下：年120万円,保護者満足度：12ポイント向上、教育・保育の質統一：90%、事故・ヒヤリハット：80%削減、職員満足度：18ポイント向上,職員のデジタルスキル向上、チームワーク強化、保護者との信頼関係向上、地域教育・保育業界での先進事例として注目,現場業務に即したカスタマイズ、低コストでの実現可能性追求、多職種連携を重視した設計、成果の見える化による動機向上,デジタル化への不安から積極活用への転換、情報共有による協働意識の向上、子どもにより良い教育・保育を提供したい気持ちの高まり、働きがいの向上,より高度な個別支援システム導入、保護者向けアプリとの連携、多施設統合管理システム、新人教育プログラムの体系化,専門知識なしでも導入可能、ROI重視でありながら教育・保育の質向上、成功事例の業界内共有による全体底上げ、教育・保育業界の人手不足解消への貢献,教育・保育向けGoogleフォームテンプレート、プライバシー配慮の記録管理、多職種情報共有ダッシュボード、教育・保育品質向上AI支援機能,学習管理システム（LMS）との連携、保護者向けポータルサイト、教材管理システムとの統合、行政システムとの報告書連動,出席・体調記録→自動異常検知→担当者通知→対応記録→効果測定→個別計画更新,個人情報保護法・子ども関連法令準拠、職員向けプライバシー保護研修、システムログの監視・管理、インシデント対応体制,事例のみ,,,,2025-07-08,2025-07-08,,"教育・保育業,絵画教室,AI活用,業務効率化,Googleフォーム,GAS,ChatGPT,地方中小企業,関西,子ども中心,保護者満足度"
153,教育・保育業,小規模保育園,教務主任,8,関東,小規模保育園（従業員8名）がデジタル化で子どもの安全管理90%向上した成功事例,教育・保育業界の人手不足解消に貢献する保護者満足度向上システム,小規模保育園が90%の業務効率化を実現。Googleフォーム+GAS+ChatGPTによる教育・保育管理システムで、従来の手作業業務を刷新し、子どもの安全と保護者満足度を大幅改善した成功事例。関東地域の教育・保育業界特性を考慮した実用的なデジタル化を低コストで実現。,関東の小規模保育園では、働く保護者の増加に伴い保育・教育サービスへの要求水準が高まる一方、人手不足により一人当たりの業務負荷が増大している。効率的な運営と質の確保の両立が課題。,園児の体調管理記録が手書きで緊急時対応に不安、給食・おやつアレルギー管理が目視確認で漏れリスク、保護者との連絡帳が紙で紛失リスク、職員シフト調整が複雑で急な変更対応困難,出席確認時間：1日平均30分、保護者連絡対応：1日1.5時間、子ども記録作成：1日90分、月謝管理：月末4時間、保護者満足度：80%,①登園・登校確認→出席記録→保護者連絡→一日の活動の流れで、出席状況の共有遅れにより保護者不安。②活動記録→写真撮影→連絡帳作成→保護者共有の流れで、記録作成に時間がかかり子どもと向き合う時間減少。,「園児の体調変化を見逃すのが心配」「アレルギー対応で確認ミスが怖い」「保護者との連絡で行き違いが心配」「緊急時の対応手順が複雑」,QRコード出席管理+Googleフォーム記録+GAS自動レポート,①現場ニーズ・課題ヒアリング（3日）②プロトタイプ開発・検証（1週間）③本格システム開発（8日）④操作マニュアル・研修準備（3日）⑤全職員研修・保護者説明（1週間）⑥運用開始・継続サポート（継続）,タブレット・スマートフォン基本操作、教育・保育業務特化Googleフォーム活用、GAS自動化による業務効率化、子どもの安全を最優先としたシステム運用、保護者満足度向上のための情報活用、継続的改善プロセス構築,小規模保育園業界の専門用語・記録様式に対応したシステム、教育・保育制度の要件を満たすデータ管理、多職種チーム連携のための情報共有設定、子どものプライバシー保護を最優先とした安全設計,1ヶ月,体調記録時間：45分→15分（65%削減）、保護者連絡時間：30分→15分（70%削減）、安全管理精度：90%→98%、子どもの安全：事故0件達成,教材・備品管理：週6時間→2時間、行事準備：週12時間→5時間、職員会議準備：週3時間→1時間,業務効率化：月10万円、システム運用費削減：月2万円、教材費最適化：月5万円,子どもの発達支援効果：90%向上、保護者信頼度：95%、職員の働きがい向上：80%、離職率：60%削減,ペーパーレス化による環境負荷軽減、情報共有文化の定着、継続的改善の習慣化、業界内での知見共有・指導,子ども・保護者の声を重視した段階的導入、プライバシー保護を最優先とした設計、教育・保育制度に準拠したシステム、継続的な現場フィードバック活用,IT活用による業務革新への意識変革、保護者からの評価向上による自信増、継続的学習・改善への取り組み強化、離職率低下とチーム安定化,より高度な個別支援システム導入、保護者向けアプリとの連携、多施設統合管理システム、新人教育プログラムの体系化,地方教育・保育施設でも月10万円以下で品質向上実現、子どものプライバシー保護を最優先とした設計、職員の働きやすさと保護者満足度の両立、法令遵守の重要性,GAS トリガーによる異常検知自動通知、ChatGPT活用の個別指導支援、LINE Bot保護者連絡、QRコード出席管理システム,既存保育・教育システムとの連携、保護者向けアプリとの連動、給食管理システムとの統合、地域子育て支援システムとの連携,保護者相談受付→記録・分析→支援計画→実施記録→モニタリング→評価・改善サイクル,子どもの個人情報の厳格な暗号化、アクセス権限の職種別設定、保護者同意に基づく情報管理、定期的なセキュリティ監査,事例のみ,,,,2025-07-08,2025-07-08,,"教育・保育業,小規模保育園,AI活用,業務効率化,Googleフォーム,GAS,ChatGPT,地方中小企業,関東,子ども中心,保護者満足度"
154,教育・保育業,幼稚園,教務主任,40,九州,従業員40名の幼稚園がGoogleフォーム工夫で個別支援70%改善,保護者との信頼関係強化と職員働きやすさを同時実現するシステム導入法,幼稚園が70%の業務効率化を実現。Googleフォーム+GAS+ChatGPTによる教育・保育管理システムで、従来の手作業業務を刷新し、子どもの安全と保護者満足度を大幅改善した成功事例。九州地域の教育・保育業界特性を考慮した実用的なデジタル化を低コストで実現。,幼稚園業界では子どもの安全確保と発達支援の質向上が最重要課題となる中、従来の手作業による記録・管理では情報共有の遅れや見落としリスクが生じている。デジタル化による安全性と効率性の向上が必要。,出席管理が手作業で遅刻・欠席連絡の確認に1日30分、保護者への連絡が電話中心で夕方集中により残業、子どもの様子記録が手書きで検索困難、月謝管理が手作業で未納確認に月末半日、教材・備品管理が目視で在庫把握困難,学習進捗確認：1人平均25分、保護者面談準備：1回60分、教材管理：週3時間、生徒満足度：75%、保護者満足度：80%,①学習計画→個別指導→進捗記録→保護者報告の流れで、個別対応の質にばらつき。②教材準備→授業実施→理解度確認→次回準備の流れで、準備時間が長く指導時間を圧迫。,「園児の体調変化を見逃すのが心配」「アレルギー対応で確認ミスが怖い」「保護者との連絡で行き違いが心配」「緊急時の対応手順が複雑」,Googleフォーム出席管理+GAS自動通知+ChatGPT保護者連絡支援,①法令・制度要件確認（2日）②既存情報のデジタル化・移行（4日）③システム構築・テスト（6日）④保護者説明会・職員研修（1週間）⑤試行運用・調整（10日）⑥本格運用・効果検証（1ヶ月）,タブレット・スマートフォン基本操作、教育・保育業務特化Googleフォーム活用、GAS自動化による業務効率化、子どもの安全を最優先としたシステム運用、保護者満足度向上のための情報活用、継続的改善プロセス構築,幼稚園特有の評価・観察項目設定、九州地域の関係機関ネットワークとの連携、24時間対応を考慮したシステム設計（保育園等）、教育・保育従事者の働き方に配慮したユーザビリティ,2ヶ月,個別指導準備時間：25分→10分（65%削減）、進捗管理時間：15分→8分（60%短縮）、保護者面談準備：60分→15分、学習効果：70%向上,教材・備品管理：週6時間→2時間、行事準備：週12時間→5時間、職員会議準備：週3時間→1時間,人件費効率化：月8万円、事務作業削減：月8万円、残業代削減：月12万円,子どもの発達支援効果：85%向上、保護者信頼度：92%、職員の働きがい向上：85%、離職率：50%削減,職員のデジタルスキル向上、チームワーク強化、保護者との信頼関係向上、地域教育・保育業界での先進事例として注目,現場業務に即したカスタマイズ、低コストでの実現可能性追求、多職種連携を重視した設計、成果の見える化による動機向上,記録業務効率化により子どもと向き合う時間増加、データに基づく教育・保育改善の取り組み活発化、職員間コミュニケーションの向上,予防的教育・保育システムの導入、地域子育て支援システムとの連携強化、保護者向けサービス拡充、教育・保育業界DX推進のリーダーシップ,Googleフォームの教育・保育特化活用法、現場職員の声を反映したカスタマイズ、継続的改善による効果最大化、多職種連携の促進,GAS トリガーによる異常検知自動通知、ChatGPT活用の個別指導支援、LINE Bot保護者連絡、QRコード出席管理システム,学習管理システム（LMS）との連携、保護者向けポータルサイト、教材管理システムとの統合、行政システムとの報告書連動,出席・体調記録→自動異常検知→担当者通知→対応記録→効果測定→個別計画更新,個人情報保護法・子ども関連法令準拠、職員向けプライバシー保護研修、システムログの監視・管理、インシデント対応体制,事例のみ,,,,2025-07-08,2025-07-08,,"教育・保育業,幼稚園,AI活用,業務効率化,Googleフォーム,GAS,ChatGPT,地方中小企業,九州,子ども中心,保護者満足度"
155,教育・保育業,幼稚園,教務主任,8,中部,従業員8名の幼稚園がGoogleフォーム工夫で個別支援60%改善,地方教育・保育事業所でも月予算10万円以下で実現可能なデジタル化術,幼稚園が60%の業務効率化を実現。Googleフォーム+GAS+ChatGPTによる教育・保育管理システムで、従来の手作業業務を刷新し、子どもの安全と保護者満足度を大幅改善した成功事例。中部地域の教育・保育業界特性を考慮した実用的なデジタル化を低コストで実現。,幼稚園業界では子どもの安全確保と発達支援の質向上が最重要課題となる中、従来の手作業による記録・管理では情報共有の遅れや見落としリスクが生じている。デジタル化による安全性と効率性の向上が必要。,園児の体調管理記録が手書きで緊急時対応に不安、給食・おやつアレルギー管理が目視確認で漏れリスク、保護者との連絡帳が紙で紛失リスク、職員シフト調整が複雑で急な変更対応困難,学習進捗確認：1人平均15分、保護者面談準備：1回60分、教材管理：週4時間、生徒満足度：80%、保護者満足度：80%,①保護者相談→記録作成→職員共有→対応策検討の流れで、情報共有不足により継続的支援困難。②安全点検→記録→共有→改善の流れで、点検結果の活用が不十分で安全性向上に課題。,「保護者の要望を覚えきれない」「子どもの発達記録の整理が大変」「職員間の申し送りが不十分」「行事準備の段取りが煩雑」,Googleフォーム学習記録+GAS進捗管理+ChatGPT個別指導計画,①現場ニーズ・課題ヒアリング（3日）②プロトタイプ開発・検証（1週間）③本格システム開発（8日）④操作マニュアル・研修準備（3日）⑤全職員研修・保護者説明（1週間）⑥運用開始・継続サポート（継続）,個人情報保護と教育・保育記録のデジタル化、子どもの発達に配慮したGoogleフォーム活用、ChatGPT活用による保護者対応支援、写真・動画の安全な管理・共有方法、保護者との効果的なコミュニケーション技術、緊急時対応のデジタル活用,幼稚園特有の評価・観察項目設定、中部地域の関係機関ネットワークとの連携、24時間対応を考慮したシステム設計（保育園等）、教育・保育従事者の働き方に配慮したユーザビリティ,10週間,体調記録時間：60分→15分（65%削減）、保護者連絡時間：40分→10分（70%削減）、安全管理精度：90%→95%、子どもの安全：事故0件達成,教材・備品管理：週6時間→2時間、行事準備：週12時間→5時間、職員会議準備：週3時間→1時間,運営効率化：月10万円、保護者満足度向上による入園・入塾増：月20万円、離職率低下：年120万円,学習効果向上：85%の生徒・保護者から高評価、個別対応満足度：90%、出席率向上：5ポイント、紹介率：20%向上,ペーパーレス化による環境負荷軽減、情報共有文化の定着、継続的改善の習慣化、業界内での知見共有・指導,現場業務に即したカスタマイズ、低コストでの実現可能性追求、多職種連携を重視した設計、成果の見える化による動機向上,IT活用による業務革新への意識変革、保護者からの評価向上による自信増、継続的学習・改善への取り組み強化、離職率低下とチーム安定化,より高度な個別支援システム導入、保護者向けアプリとの連携、多施設統合管理システム、新人教育プログラムの体系化,地方教育・保育施設でも月10万円以下で品質向上実現、子どものプライバシー保護を最優先とした設計、職員の働きやすさと保護者満足度の両立、法令遵守の重要性,Googleフォーム+GAS+ChatGPTの教育・保育特化連携、子ども情報自動分類・個別支援計画支援、出席・体調記録自動化、保護者連絡自動生成,学習管理システム（LMS）との連携、保護者向けポータルサイト、教材管理システムとの統合、行政システムとの報告書連動,保護者相談受付→記録・分析→支援計画→実施記録→モニタリング→評価・改善サイクル,子どもの個人情報の厳格な暗号化、アクセス権限の職種別設定、保護者同意に基づく情報管理、定期的なセキュリティ監査,事例のみ,,,,2025-07-08,2025-07-08,,"教育・保育業,幼稚園,AI活用,業務効率化,Googleフォーム,GAS,ChatGPT,地方中小企業,中部,子ども中心,保護者満足度"
